<?xml version="1.0" encoding="UTF-8"?>
<?xml-stylesheet type="text/xsl" href="file:/C:/Users/user/Downloads/style_menu2.xsl"?>
<menu_restauracji xmlns:xsi="http://www.w3.org/2001/XMLSchema-instance" xsi:noNamespaceSchemaLocation="file:/C:/Users/user/Downloads/schemaMenu2.xsd">
    <kategoria nazwa="Przystawki">
      <danie typ="wegetariańskie" cena="18" na_wagę="NIE">
          <nazwa>Carpaccio z pieczonych burakow</nazwa>
          <skladniki>
            <skladnik>Buraki</skladnik>
            <skladnik>Orzechy</skladnik>
            <skladnik>Ser kozi</skladnik>
          </skladniki>
      </danie>
    </kategoria>
    <kategoria nazwa="Dania główne">
      <danie typ="mięsne" cena="25" na_wagę="NIE">
         <nazwa>Rolada śląska</nazwa>
         <skladniki>
           <skladnik>Wieprzowina</skladnik>
            <skladnik>Ogorek</skladnik>
         </skladniki>
      </danie>
      <danie typ="ryby i owoce morza" cena="20" na_wagę="NIE">
          <nazwa>Filet z łososia</nazwa>
          <skladniki>
            <skladnik>Łosoś</skladnik>
            <skladnik>Ziemniaki</skladnik>
          </skladniki>
      </danie>
      <danie typ="makarony" cena="16" na_wagę="NIE">
        <nazwa>Rigatoni</nazwa>
        <skladniki>
          <skladnik>Sos pomidorowy</skladnik>
          <skladnik>Czosnek</skladnik>
        </skladniki>
      </danie>
    </kategoria>
    <kategoria nazwa="Zupy">
        <danie cena="7">
          <nazwa>Zupa pomidorowa</nazwa>
          <skladniki>
            <skladnik>Pomidory</skladnik>
            <skladnik>Czosnek</skladnik>
          </skladniki>
        </danie>
    </kategoria>
    <kategoria nazwa="Desery">
        <danie cena="14">
          <nazwa>Tiramisu</nazwa>
          <skladniki>
            <skladnik>Biszkopt</skladnik>
            <skladnik>Espresso</skladnik>
            <skladnik>Ser Mascarpone</skladnik>
          </skladniki>
        </danie>
    </kategoria>
    <napoje nazwa="Napoje">
      <napój cena="5">Kawa</napój>
      <napój cena="4">Herbata</napój>
    </napoje>
    <dodatki nazwa="Dodatki">
      <dodatek cena="7">Frytki</dodatek>
      <dodatek cena="11">Sałatka cezar</dodatek>
    </dodatki>
</menu_restauracji>
